{"book":"Mark","candidate_only":true,"controller_event_ids":["evt-mark-r8-held-1-manifest"],"identity":{"agent_instance_id":"controller-mark-r8","assignment_id":"asg-mark-r8-held-1-controller","execution_id":"exec-mark-r8-held-1-controller","provider_family":"provider-neutral","role_id":"controller"},"input_manifest_sha256":"sha256:ca3ee75a63f34267a0c0b6a0ca9aaac03b872cf50a19f01b20f271a9b01e69a5","kind":"input_manifest","non_authorizing":true,"run_id":"mark-r8-held-1","schema_version":"whole_bible_b01_input_manifest.v1","source_digests":{"C:_Users_lowel_OneDrive_Desktop_Git Projects_03_World_View_logos-scripture-graph-repo_.ai_control_autonomous_corpus_processor.yaml":"sha256:69d5f94db93d80da8e52bd95e45e864c4bccf63421e1ceda346b4d462cfa079b","C:_Users_lowel_OneDrive_Desktop_Git Projects_03_World_View_logos-scripture-graph-repo_.ai_control_bible_wide_chunking_research_registry.yaml":"sha256:20b034a85b0a21c2f1f4b360af86201d839283b75c4f49be9db771c997411a57","C:_Users_lowel_OneDrive_Desktop_Git Projects_03_World_View_logos-scripture-graph-repo_.ai_control_contextual_reading_policy.yaml":"sha256:f5eaa59e76cf7c7025ed91647e90d6a7f4839829616565f0a513e5583c099227","C:_Users_lowel_OneDrive_Desktop_Git Projects_03_World_View_logos-scripture-graph-repo_.ai_control_t423_literary_marker_quality_protocol.yaml":"sha256:c5be395efa5b763288d54370e9ef7be115b321d6efdd9cdd91cd0a926e386acb","C:_Users_lowel_OneDrive_Desktop_Git Projects_03_World_View_logos-scripture-graph-repo_.ai_control_t468_owner_faithful_chunking_policy.yaml":"sha256:22cae326ad8b7f7aa4f198b56072e8d71b5787689ad85d7138cec1a30f8bf073","C:_Users_lowel_OneDrive_Desktop_Git Projects_03_World_View_logos-scripture-graph-repo_config_agents_families_scripture-first-biblical-chunking_codex_desktop_campaign_adapter.v2.yaml":"sha256:7cf7f79a7cea81d70d1e62ad5f6b514c041c440298b68d3d4f2423e9d4a0f346","C:_Users_lowel_OneDrive_Desktop_Git Projects_03_World_View_logos-scripture-graph-repo_config_agents_families_scripture-first-biblical-chunking_whole_bible_campaign_registry.v1.json":"sha256:f9009f0e4a7122bffe292ea3f776e54aecd37487e9ad2d8b309a44e4e7dfe4c9","C:_Users_lowel_OneDrive_Desktop_Git Projects_03_World_View_logos-scripture-graph-repo_config_agents_families_scripture-first-biblical-chunking_whole_bible_candidate_prompt_pack.v2.yaml":"sha256:fab0458beab0dade9bfec3f6261bfffa8e668e9ff42c5fb6343660431b6c441c","C:_Users_lowel_OneDrive_Desktop_Git Projects_03_World_View_logos-scripture-graph-repo_config_agents_families_scripture-first-biblical-chunking_whole_bible_candidate_workflow.v2.yaml":"sha256:d5ec386bb5728f7b923672dae62d8bc330c7bf1b652c29e1ce520f54ff5d0c81","C:_Users_lowel_OneDrive_Desktop_Git Projects_03_World_View_logos-scripture-graph-repo_config_chunking_form_registry.yaml":"sha256:2b397386d589c0409746c16418fc49d8bfcac20f6e48a82b2603a449dd57f1e7","C:_Users_lowel_OneDrive_Desktop_Git Projects_03_World_View_logos-scripture-graph-repo_data_candidate_original_language_evidence_canonical_source_views_cntr_sr_canonical_source_view_manifest.yaml":"sha256:eed0eda4e7393baaaad27f7636ee69519d367583939402fd7a9bd47155fceca8","C:_Users_lowel_OneDrive_Desktop_Git Projects_03_World_View_logos-scripture-graph-repo_data_candidate_original_language_evidence_canonical_source_views_cntr_sr_included_files.jsonl":"sha256:fd7c3d7cb37513e9606f83ee52fed7c26e9dced163ada4b206f9c402716526e5","C:_Users_lowel_OneDrive_Desktop_Git Projects_03_World_View_logos-scripture-graph-repo_data_canonical_scripture_passages_passages.jsonl":"sha256:3b3b3ee2ea05dcfcea534264f8686b341a34e925aec491d699a92591d9f49bcc","C:_Users_lowel_OneDrive_Desktop_Git Projects_03_World_View_logos-scripture-graph-repo_data_canonical_translations_eng-web_translation_witnesses.jsonl":"sha256:9b5b5d416f36d106bd8185251261282dca185da3a93389e7917a3671f21da5c5","C:_Users_lowel_OneDrive_Desktop_Git Projects_03_World_View_logos-scripture-graph-repo_data_raw_original_language_greek_cntr_sr_raw_cntr_sr-4be18e67c687.zip":"sha256:79d2eec8b9eefc7c11cdec9cd8243b57e15ff5fac07bc064768f5ec92b6cef9a","C:_Users_lowel_OneDrive_Desktop_Git Projects_03_World_View_logos-scripture-graph-repo_data_raw_original_language_greek_cntr_sr_source_manifest.yaml":"sha256:ce4f9d450dd4f33aa4d4ceb361414323aaa9a1103ea9b8a89289614845962cf3","C:_Users_lowel_OneDrive_Desktop_Git Projects_03_World_View_logos-scripture-graph-repo_data_raw_original_language_greek_sblgnt_raw_sblgnt-c4d241a9c1c4.zip":"sha256:4fc2659ce10ec6f57552f22e039de927ed3e417c7b5a757f34f05dae530e4c0f","C:_Users_lowel_OneDrive_Desktop_Git Projects_03_World_View_logos-scripture-graph-repo_data_raw_original_language_greek_sblgnt_source_manifest.yaml":"sha256:6e97b181f755563bff00f4efcb2972c70aef73ffa8ff3b9f2d6c91df33a98eef","C:_Users_lowel_OneDrive_Desktop_Git Projects_03_World_View_logos-scripture-graph-repo_data_raw_original_language_greek_ugnt_raw_ugnt-6377ea89a718.zip":"sha256:fe59e641857b382e86935038cffe657125a1d9936208444627b7426fe8df1735","C:_Users_lowel_OneDrive_Desktop_Git Projects_03_World_View_logos-scripture-graph-repo_data_raw_original_language_greek_ugnt_source_manifest.yaml":"sha256:de7f845d552fff17cd4ae44d33eaa97695239d8a6e63338da99b90a4fbedf677"},"source_ids":["C:_Users_lowel_OneDrive_Desktop_Git Projects_03_World_View_logos-scripture-graph-repo_.ai_control_autonomous_corpus_processor.yaml","C:_Users_lowel_OneDrive_Desktop_Git Projects_03_World_View_logos-scripture-graph-repo_.ai_control_bible_wide_chunking_research_registry.yaml","C:_Users_lowel_OneDrive_Desktop_Git Projects_03_World_View_logos-scripture-graph-repo_.ai_control_contextual_reading_policy.yaml","C:_Users_lowel_OneDrive_Desktop_Git Projects_03_World_View_logos-scripture-graph-repo_.ai_control_t423_literary_marker_quality_protocol.yaml","C:_Users_lowel_OneDrive_Desktop_Git Projects_03_World_View_logos-scripture-graph-repo_.ai_control_t468_owner_faithful_chunking_policy.yaml","C:_Users_lowel_OneDrive_Desktop_Git Projects_03_World_View_logos-scripture-graph-repo_config_agents_families_scripture-first-biblical-chunking_codex_desktop_campaign_adapter.v2.yaml","C:_Users_lowel_OneDrive_Desktop_Git Projects_03_World_View_logos-scripture-graph-repo_config_agents_families_scripture-first-biblical-chunking_whole_bible_campaign_registry.v1.json","C:_Users_lowel_OneDrive_Desktop_Git Projects_03_World_View_logos-scripture-graph-repo_config_agents_families_scripture-first-biblical-chunking_whole_bible_candidate_prompt_pack.v2.yaml","C:_Users_lowel_OneDrive_Desktop_Git Projects_03_World_View_logos-scripture-graph-repo_config_agents_families_scripture-first-biblical-chunking_whole_bible_candidate_workflow.v2.yaml","C:_Users_lowel_OneDrive_Desktop_Git Projects_03_World_View_logos-scripture-graph-repo_config_chunking_form_registry.yaml","C:_Users_lowel_OneDrive_Desktop_Git Projects_03_World_View_logos-scripture-graph-repo_data_candidate_original_language_evidence_canonical_source_views_cntr_sr_canonical_source_view_manifest.yaml","C:_Users_lowel_OneDrive_Desktop_Git Projects_03_World_View_logos-scripture-graph-repo_data_candidate_original_language_evidence_canonical_source_views_cntr_sr_included_files.jsonl","C:_Users_lowel_OneDrive_Desktop_Git Projects_03_World_View_logos-scripture-graph-repo_data_canonical_scripture_passages_passages.jsonl","C:_Users_lowel_OneDrive_Desktop_Git Projects_03_World_View_logos-scripture-graph-repo_data_canonical_translations_eng-web_translation_witnesses.jsonl","C:_Users_lowel_OneDrive_Desktop_Git Projects_03_World_View_logos-scripture-graph-repo_data_raw_original_language_greek_cntr_sr_raw_cntr_sr-4be18e67c687.zip","C:_Users_lowel_OneDrive_Desktop_Git Projects_03_World_View_logos-scripture-graph-repo_data_raw_original_language_greek_cntr_sr_source_manifest.yaml","C:_Users_lowel_OneDrive_Desktop_Git Projects_03_World_View_logos-scripture-graph-repo_data_raw_original_language_greek_sblgnt_raw_sblgnt-c4d241a9c1c4.zip","C:_Users_lowel_OneDrive_Desktop_Git Projects_03_World_View_logos-scripture-graph-repo_data_raw_original_language_greek_sblgnt_source_manifest.yaml","C:_Users_lowel_OneDrive_Desktop_Git Projects_03_World_View_logos-scripture-graph-repo_data_raw_original_language_greek_ugnt_raw_ugnt-6377ea89a718.zip","C:_Users_lowel_OneDrive_Desktop_Git Projects_03_World_View_logos-scripture-graph-repo_data_raw_original_language_greek_ugnt_source_manifest.yaml"],"stage_attempt_id":"b01-controller-1"}