{"book":"Lev","candidate_only":true,"controller_event_ids":["evt-lev-r8-held-1-manifest"],"identity":{"agent_instance_id":"controller-lev-r8","assignment_id":"asg-lev-r8-held-1-controller","execution_id":"exec-lev-r8-held-1-controller","provider_family":"provider-neutral","role_id":"controller"},"input_manifest_sha256":"sha256:8634127b920158f3c80c5f9e2f79f0f73062256ee4a0a859c2725dd7fe5cc037","kind":"input_manifest","non_authorizing":true,"run_id":"lev-r8-held-1","schema_version":"whole_bible_b01_input_manifest.v1","source_digests":{"C:_Users_lowel_OneDrive_Desktop_Git Projects_03_World_View_logos-scripture-graph-repo_.ai_control_autonomous_corpus_processor.yaml":"sha256:69d5f94db93d80da8e52bd95e45e864c4bccf63421e1ceda346b4d462cfa079b","C:_Users_lowel_OneDrive_Desktop_Git Projects_03_World_View_logos-scripture-graph-repo_.ai_control_bible_wide_chunking_research_registry.yaml":"sha256:20b034a85b0a21c2f1f4b360af86201d839283b75c4f49be9db771c997411a57","C:_Users_lowel_OneDrive_Desktop_Git Projects_03_World_View_logos-scripture-graph-repo_.ai_control_contextual_reading_policy.yaml":"sha256:f5eaa59e76cf7c7025ed91647e90d6a7f4839829616565f0a513e5583c099227","C:_Users_lowel_OneDrive_Desktop_Git Projects_03_World_View_logos-scripture-graph-repo_.ai_control_t423_literary_marker_quality_protocol.yaml":"sha256:c5be395efa5b763288d54370e9ef7be115b321d6efdd9cdd91cd0a926e386acb","C:_Users_lowel_OneDrive_Desktop_Git Projects_03_World_View_logos-scripture-graph-repo_.ai_control_t468_owner_faithful_chunking_policy.yaml":"sha256:22cae326ad8b7f7aa4f198b56072e8d71b5787689ad85d7138cec1a30f8bf073","C:_Users_lowel_OneDrive_Desktop_Git Projects_03_World_View_logos-scripture-graph-repo_config_agents_families_scripture-first-biblical-chunking_codex_desktop_campaign_adapter.v2.yaml":"sha256:7cf7f79a7cea81d70d1e62ad5f6b514c041c440298b68d3d4f2423e9d4a0f346","C:_Users_lowel_OneDrive_Desktop_Git Projects_03_World_View_logos-scripture-graph-repo_config_agents_families_scripture-first-biblical-chunking_whole_bible_campaign_registry.v1.json":"sha256:f9009f0e4a7122bffe292ea3f776e54aecd37487e9ad2d8b309a44e4e7dfe4c9","C:_Users_lowel_OneDrive_Desktop_Git Projects_03_World_View_logos-scripture-graph-repo_config_agents_families_scripture-first-biblical-chunking_whole_bible_candidate_prompt_pack.v2.yaml":"sha256:fab0458beab0dade9bfec3f6261bfffa8e668e9ff42c5fb6343660431b6c441c","C:_Users_lowel_OneDrive_Desktop_Git Projects_03_World_View_logos-scripture-graph-repo_config_agents_families_scripture-first-biblical-chunking_whole_bible_candidate_workflow.v2.yaml":"sha256:d5ec386bb5728f7b923672dae62d8bc330c7bf1b652c29e1ce520f54ff5d0c81","C:_Users_lowel_OneDrive_Desktop_Git Projects_03_World_View_logos-scripture-graph-repo_config_chunking_form_registry.yaml":"sha256:2b397386d589c0409746c16418fc49d8bfcac20f6e48a82b2603a449dd57f1e7","C:_Users_lowel_OneDrive_Desktop_Git Projects_03_World_View_logos-scripture-graph-repo_data_candidate_original_language_evidence_canonical_source_views_openscriptures_oshb_canonical_source_view_manifest.yaml":"sha256:4108190f1417f4b1513c04f53883aeaa6e3c41d4d9327c56651fcbed6b480379","C:_Users_lowel_OneDrive_Desktop_Git Projects_03_World_View_logos-scripture-graph-repo_data_candidate_original_language_evidence_canonical_source_views_openscriptures_oshb_files_Lev.xml":"sha256:e21e70265c9ef500182f8ccb4f4e1186e5a79e1169d24cef23cc479baf07b191","C:_Users_lowel_OneDrive_Desktop_Git Projects_03_World_View_logos-scripture-graph-repo_data_candidate_original_language_evidence_canonical_source_views_openscriptures_oshb_included_files.jsonl":"sha256:d06f2b7ca43417dd62bfc2ca81384e95512af39410b70c36398be6bc8b7d34cd","C:_Users_lowel_OneDrive_Desktop_Git Projects_03_World_View_logos-scripture-graph-repo_data_candidate_original_language_evidence_canonical_source_views_tanach_us_uxlc_canonical_source_view_manifest.yaml":"sha256:816847302bc03bb6a50b829a892768445d2da4b9c532e6f3bc42f58224ae7f4c","C:_Users_lowel_OneDrive_Desktop_Git Projects_03_World_View_logos-scripture-graph-repo_data_candidate_original_language_evidence_canonical_source_views_tanach_us_uxlc_files_Lev.xml":"sha256:6c9fc7df5ec9c17615b8dba91704fb024663b7f78f85ac0e6a3a7876c9a54ae2","C:_Users_lowel_OneDrive_Desktop_Git Projects_03_World_View_logos-scripture-graph-repo_data_candidate_original_language_evidence_canonical_source_views_tanach_us_uxlc_included_files.jsonl":"sha256:20fe96f3c6698b82f0902953e3605d654c7be9f478dc606bb9a6db9d7d40933c","C:_Users_lowel_OneDrive_Desktop_Git Projects_03_World_View_logos-scripture-graph-repo_data_canonical_scripture_passages_passages.jsonl":"sha256:3b3b3ee2ea05dcfcea534264f8686b341a34e925aec491d699a92591d9f49bcc","C:_Users_lowel_OneDrive_Desktop_Git Projects_03_World_View_logos-scripture-graph-repo_data_canonical_translations_eng-web_translation_witnesses.jsonl":"sha256:9b5b5d416f36d106bd8185251261282dca185da3a93389e7917a3671f21da5c5","C:_Users_lowel_OneDrive_Desktop_Git Projects_03_World_View_logos-scripture-graph-repo_data_raw_original_language_hebrew_openscriptures_oshb_raw_openscriptures_oshb-3d15126fb1ef.zip":"sha256:f56c150708b5d74719ecb709c712c31eae9855bca7b111fd82ec91b5d177b4c7","C:_Users_lowel_OneDrive_Desktop_Git Projects_03_World_View_logos-scripture-graph-repo_data_raw_original_language_hebrew_openscriptures_oshb_source_manifest.yaml":"sha256:34d8adafe421a9085da9a4c6a17fd3288434bd88acdbece7e43e73d6c6db37d5","C:_Users_lowel_OneDrive_Desktop_Git Projects_03_World_View_logos-scripture-graph-repo_data_raw_original_language_hebrew_tanach_us_uxlc_raw_Tanach.xml.zip":"sha256:1bc6e006f43d3b18f2f718cefa3aa4774cac2c54092c28d173dd61996c43a050","C:_Users_lowel_OneDrive_Desktop_Git Projects_03_World_View_logos-scripture-graph-repo_data_raw_original_language_hebrew_tanach_us_uxlc_source_manifest.yaml":"sha256:416fcc70a8f862dbd58091a93b8ac2af884e326d8547ad20f711bc41dca2c3e5"},"source_ids":["C:_Users_lowel_OneDrive_Desktop_Git Projects_03_World_View_logos-scripture-graph-repo_.ai_control_autonomous_corpus_processor.yaml","C:_Users_lowel_OneDrive_Desktop_Git Projects_03_World_View_logos-scripture-graph-repo_.ai_control_bible_wide_chunking_research_registry.yaml","C:_Users_lowel_OneDrive_Desktop_Git Projects_03_World_View_logos-scripture-graph-repo_.ai_control_contextual_reading_policy.yaml","C:_Users_lowel_OneDrive_Desktop_Git Projects_03_World_View_logos-scripture-graph-repo_.ai_control_t423_literary_marker_quality_protocol.yaml","C:_Users_lowel_OneDrive_Desktop_Git Projects_03_World_View_logos-scripture-graph-repo_.ai_control_t468_owner_faithful_chunking_policy.yaml","C:_Users_lowel_OneDrive_Desktop_Git Projects_03_World_View_logos-scripture-graph-repo_config_agents_families_scripture-first-biblical-chunking_codex_desktop_campaign_adapter.v2.yaml","C:_Users_lowel_OneDrive_Desktop_Git Projects_03_World_View_logos-scripture-graph-repo_config_agents_families_scripture-first-biblical-chunking_whole_bible_campaign_registry.v1.json","C:_Users_lowel_OneDrive_Desktop_Git Projects_03_World_View_logos-scripture-graph-repo_config_agents_families_scripture-first-biblical-chunking_whole_bible_candidate_prompt_pack.v2.yaml","C:_Users_lowel_OneDrive_Desktop_Git Projects_03_World_View_logos-scripture-graph-repo_config_agents_families_scripture-first-biblical-chunking_whole_bible_candidate_workflow.v2.yaml","C:_Users_lowel_OneDrive_Desktop_Git Projects_03_World_View_logos-scripture-graph-repo_config_chunking_form_registry.yaml","C:_Users_lowel_OneDrive_Desktop_Git Projects_03_World_View_logos-scripture-graph-repo_data_candidate_original_language_evidence_canonical_source_views_openscriptures_oshb_canonical_source_view_manifest.yaml","C:_Users_lowel_OneDrive_Desktop_Git Projects_03_World_View_logos-scripture-graph-repo_data_candidate_original_language_evidence_canonical_source_views_openscriptures_oshb_files_Lev.xml","C:_Users_lowel_OneDrive_Desktop_Git Projects_03_World_View_logos-scripture-graph-repo_data_candidate_original_language_evidence_canonical_source_views_openscriptures_oshb_included_files.jsonl","C:_Users_lowel_OneDrive_Desktop_Git Projects_03_World_View_logos-scripture-graph-repo_data_candidate_original_language_evidence_canonical_source_views_tanach_us_uxlc_canonical_source_view_manifest.yaml","C:_Users_lowel_OneDrive_Desktop_Git Projects_03_World_View_logos-scripture-graph-repo_data_candidate_original_language_evidence_canonical_source_views_tanach_us_uxlc_files_Lev.xml","C:_Users_lowel_OneDrive_Desktop_Git Projects_03_World_View_logos-scripture-graph-repo_data_candidate_original_language_evidence_canonical_source_views_tanach_us_uxlc_included_files.jsonl","C:_Users_lowel_OneDrive_Desktop_Git Projects_03_World_View_logos-scripture-graph-repo_data_canonical_scripture_passages_passages.jsonl","C:_Users_lowel_OneDrive_Desktop_Git Projects_03_World_View_logos-scripture-graph-repo_data_canonical_translations_eng-web_translation_witnesses.jsonl","C:_Users_lowel_OneDrive_Desktop_Git Projects_03_World_View_logos-scripture-graph-repo_data_raw_original_language_hebrew_openscriptures_oshb_raw_openscriptures_oshb-3d15126fb1ef.zip","C:_Users_lowel_OneDrive_Desktop_Git Projects_03_World_View_logos-scripture-graph-repo_data_raw_original_language_hebrew_openscriptures_oshb_source_manifest.yaml","C:_Users_lowel_OneDrive_Desktop_Git Projects_03_World_View_logos-scripture-graph-repo_data_raw_original_language_hebrew_tanach_us_uxlc_raw_Tanach.xml.zip","C:_Users_lowel_OneDrive_Desktop_Git Projects_03_World_View_logos-scripture-graph-repo_data_raw_original_language_hebrew_tanach_us_uxlc_source_manifest.yaml"],"stage_attempt_id":"b01-controller-1"}